{
  "$comment": "Seed lookup table for auto-completing the `industry_id` field on previous_brands when a user types a brand name. Resolution order at runtime: 1) exact name match (case-insensitive), 2) alias match, 3) domain match, 4) AI inference fallback (later phase). New successful AI inferences should be appended here so the seed grows over time.",
  "version": "1.0.0",
  "updated": "2026-05-26",
  "brands": [
    { "name": "Nike", "industry_id": "sportswear", "domain": "nike.com" },
    { "name": "Adidas", "industry_id": "sportswear", "domain": "adidas.com" },
    { "name": "Puma", "industry_id": "sportswear", "domain": "puma.com" },
    { "name": "Under Armour", "industry_id": "sportswear", "domain": "underarmour.com" },
    { "name": "Reebok", "industry_id": "sportswear", "domain": "reebok.com" },
    { "name": "ASICS", "industry_id": "sportswear", "domain": "asics.com" },
    { "name": "New Balance", "industry_id": "sportswear", "domain": "newbalance.com" },
    { "name": "Hoka", "industry_id": "sportswear", "aliases": ["hoka one one"], "domain": "hoka.com" },
    { "name": "On Running", "industry_id": "sportswear", "aliases": ["on"], "domain": "on-running.com" },
    { "name": "Gymshark", "industry_id": "activewear", "domain": "gymshark.com" },
    { "name": "Lululemon", "industry_id": "activewear", "domain": "lululemon.com" },
    { "name": "Alo Yoga", "industry_id": "activewear", "aliases": ["alo"], "domain": "aloyoga.com" },
    { "name": "Vuori", "industry_id": "activewear", "domain": "vuoriclothing.com" },
    { "name": "Outdoor Voices", "industry_id": "activewear", "domain": "outdoorvoices.com" },
    { "name": "Patagonia", "industry_id": "outdoor-gear", "domain": "patagonia.com" },
    { "name": "The North Face", "industry_id": "outdoor-gear", "domain": "thenorthface.com" },
    { "name": "Columbia", "industry_id": "outdoor-gear", "domain": "columbia.com" },
    { "name": "Arc'teryx", "industry_id": "outdoor-gear", "domain": "arcteryx.com" },
    { "name": "REI", "industry_id": "outdoor-gear", "domain": "rei.com" },

    { "name": "Peloton", "industry_id": "fitness-equipment", "domain": "onepeloton.com" },
    { "name": "Tonal", "industry_id": "fitness-equipment", "domain": "tonal.com" },
    { "name": "Hydrow", "industry_id": "fitness-equipment", "domain": "hydrow.com" },
    { "name": "Whoop", "industry_id": "wearables", "domain": "whoop.com" },
    { "name": "Oura", "industry_id": "wearables", "aliases": ["oura ring"], "domain": "ouraring.com" },
    { "name": "Garmin", "industry_id": "wearables", "domain": "garmin.com" },
    { "name": "Fitbit", "industry_id": "wearables", "domain": "fitbit.com" },

    { "name": "Myprotein", "industry_id": "sports-nutrition", "domain": "myprotein.com" },
    { "name": "Optimum Nutrition", "industry_id": "sports-nutrition", "aliases": ["on nutrition"], "domain": "optimumnutrition.com" },
    { "name": "Huel", "industry_id": "sports-nutrition", "domain": "huel.com" },
    { "name": "AG1", "industry_id": "supplements-brands", "aliases": ["athletic greens"], "domain": "drinkag1.com" },
    { "name": "Ritual", "industry_id": "supplements-brands", "domain": "ritual.com" },

    { "name": "Sephora", "industry_id": "specialty-retail", "domain": "sephora.com" },
    { "name": "Ulta", "industry_id": "specialty-retail", "aliases": ["ulta beauty"], "domain": "ulta.com" },
    { "name": "Boots", "industry_id": "specialty-retail", "domain": "boots.com" },
    { "name": "Glossier", "industry_id": "cosmetics", "domain": "glossier.com" },
    { "name": "Charlotte Tilbury", "industry_id": "cosmetics", "domain": "charlottetilbury.com" },
    { "name": "Rare Beauty", "industry_id": "cosmetics", "domain": "rarebeauty.com" },
    { "name": "Fenty Beauty", "industry_id": "cosmetics", "aliases": ["fenty"], "domain": "fentybeauty.com" },
    { "name": "MAC Cosmetics", "industry_id": "cosmetics", "aliases": ["mac"], "domain": "maccosmetics.com" },
    { "name": "NARS", "industry_id": "cosmetics", "domain": "narscosmetics.com" },
    { "name": "Estée Lauder", "industry_id": "cosmetics", "aliases": ["estee lauder"], "domain": "esteelauder.com" },
    { "name": "L'Oréal", "industry_id": "cosmetics", "aliases": ["loreal"], "domain": "loreal.com" },
    { "name": "Maybelline", "industry_id": "cosmetics", "domain": "maybelline.com" },
    { "name": "CeraVe", "industry_id": "skincare-brands", "domain": "cerave.com" },
    { "name": "The Ordinary", "industry_id": "skincare-brands", "domain": "theordinary.com" },
    { "name": "Drunk Elephant", "industry_id": "skincare-brands", "domain": "drunkelephant.com" },
    { "name": "Olaplex", "industry_id": "haircare-brands", "domain": "olaplex.com" },
    { "name": "Dyson", "industry_id": "home-appliances", "domain": "dyson.com" },
    { "name": "Manscaped", "industry_id": "mens-grooming", "domain": "manscaped.com" },
    { "name": "Dollar Shave Club", "industry_id": "mens-grooming", "domain": "dollarshaveclub.com" },
    { "name": "Harry's", "industry_id": "mens-grooming", "aliases": ["harrys"], "domain": "harrys.com" },
    { "name": "Gillette", "industry_id": "mens-grooming", "domain": "gillette.com" },

    { "name": "Zara", "industry_id": "fast-fashion", "domain": "zara.com" },
    { "name": "H&M", "industry_id": "fast-fashion", "aliases": ["hm", "h and m"], "domain": "hm.com" },
    { "name": "Shein", "industry_id": "fast-fashion", "domain": "shein.com" },
    { "name": "Uniqlo", "industry_id": "fashion-apparel", "domain": "uniqlo.com" },
    { "name": "ASOS", "industry_id": "marketplaces-ecom", "domain": "asos.com" },
    { "name": "Boohoo", "industry_id": "fast-fashion", "domain": "boohoo.com" },
    { "name": "PrettyLittleThing", "industry_id": "fast-fashion", "aliases": ["plt"], "domain": "prettylittlething.com" },
    { "name": "Gucci", "industry_id": "luxury-goods", "domain": "gucci.com" },
    { "name": "Louis Vuitton", "industry_id": "luxury-goods", "aliases": ["lv"], "domain": "louisvuitton.com" },
    { "name": "Chanel", "industry_id": "luxury-goods", "domain": "chanel.com" },
    { "name": "Hermès", "industry_id": "luxury-goods", "aliases": ["hermes"], "domain": "hermes.com" },
    { "name": "Prada", "industry_id": "luxury-goods", "domain": "prada.com" },
    { "name": "Dior", "industry_id": "luxury-goods", "domain": "dior.com" },
    { "name": "Burberry", "industry_id": "luxury-goods", "domain": "burberry.com" },
    { "name": "Rolex", "industry_id": "watches", "domain": "rolex.com" },
    { "name": "Tag Heuer", "industry_id": "watches", "domain": "tagheuer.com" },
    { "name": "Cartier", "industry_id": "jewellery", "domain": "cartier.com" },
    { "name": "Tiffany & Co", "industry_id": "jewellery", "aliases": ["tiffany"], "domain": "tiffany.com" },
    { "name": "Pandora", "industry_id": "jewellery", "domain": "pandora.net" },
    { "name": "Ray-Ban", "industry_id": "eyewear", "aliases": ["rayban"], "domain": "ray-ban.com" },
    { "name": "Warby Parker", "industry_id": "eyewear", "domain": "warbyparker.com" },
    { "name": "Oakley", "industry_id": "eyewear", "domain": "oakley.com" },
    { "name": "Allbirds", "industry_id": "footwear", "domain": "allbirds.com" },
    { "name": "Crocs", "industry_id": "footwear", "domain": "crocs.com" },
    { "name": "Dr. Martens", "industry_id": "footwear", "aliases": ["doc martens"], "domain": "drmartens.com" },

    { "name": "Coca-Cola", "industry_id": "soft-drinks", "aliases": ["coke", "coca cola"], "domain": "coca-cola.com" },
    { "name": "Pepsi", "industry_id": "soft-drinks", "domain": "pepsi.com" },
    { "name": "Red Bull", "industry_id": "soft-drinks", "domain": "redbull.com" },
    { "name": "Monster Energy", "industry_id": "soft-drinks", "aliases": ["monster"], "domain": "monsterenergy.com" },
    { "name": "Celsius", "industry_id": "soft-drinks", "domain": "celsius.com" },
    { "name": "Liquid Death", "industry_id": "bottled-water", "domain": "liquiddeath.com" },
    { "name": "Heineken", "industry_id": "alcohol-beer", "domain": "heineken.com" },
    { "name": "Guinness", "industry_id": "alcohol-beer", "domain": "guinness.com" },
    { "name": "Stella Artois", "industry_id": "alcohol-beer", "domain": "stellaartois.com" },
    { "name": "BrewDog", "industry_id": "alcohol-beer", "domain": "brewdog.com" },
    { "name": "Don Julio", "industry_id": "alcohol-spirits", "domain": "donjulio.com" },
    { "name": "Patrón", "industry_id": "alcohol-spirits", "aliases": ["patron"], "domain": "patrontequila.com" },
    { "name": "Grey Goose", "industry_id": "alcohol-spirits", "domain": "greygoose.com" },
    { "name": "Hendrick's", "industry_id": "alcohol-spirits", "aliases": ["hendricks"], "domain": "hendricksgin.com" },
    { "name": "Veuve Clicquot", "industry_id": "alcohol-wine", "domain": "veuveclicquot.com" },
    { "name": "Moët & Chandon", "industry_id": "alcohol-wine", "aliases": ["moet"], "domain": "moet.com" },

    { "name": "McDonald's", "industry_id": "restaurants-qsr", "aliases": ["mcdonalds"], "domain": "mcdonalds.com" },
    { "name": "Burger King", "industry_id": "restaurants-qsr", "domain": "bk.com" },
    { "name": "KFC", "industry_id": "restaurants-qsr", "domain": "kfc.com" },
    { "name": "Subway", "industry_id": "restaurants-qsr", "domain": "subway.com" },
    { "name": "Chipotle", "industry_id": "restaurants-qsr", "domain": "chipotle.com" },
    { "name": "Domino's", "industry_id": "restaurants-qsr", "aliases": ["dominos"], "domain": "dominos.com" },
    { "name": "Starbucks", "industry_id": "coffee-tea", "domain": "starbucks.com" },
    { "name": "Dunkin'", "industry_id": "restaurants-qsr", "aliases": ["dunkin", "dunkin donuts"], "domain": "dunkindonuts.com" },
    { "name": "DoorDash", "industry_id": "food-delivery", "domain": "doordash.com" },
    { "name": "Uber Eats", "industry_id": "food-delivery", "domain": "ubereats.com" },
    { "name": "Deliveroo", "industry_id": "food-delivery", "domain": "deliveroo.com" },